{
  "evidence_record_version": 1,
  "operation_id": "execution_recovery.repair-open-or-invalid-geometry",
  "template_version": "0.1.0",
  "recorded_on": "2026-09-08",
  "command": "python -B -m unittest tests.test_execution_guidance -v",
  "result": "passed",
  "exit_code": 0,
  "tests_run": 5,
  "tool": "spaceclaim-vision-modeling/references/atomic-guidance/er-07.json",
  "tool_sha256": "0031dfb7e87cf02b76c83d3dc9ca84e92c10c43fd1f56b560ce2d1146861568f",
  "test": "tests/test_execution_guidance.py",
  "test_sha256": "f3918ac4379f5488144fab920f60d121aa4e5863ef91808bb4ae04b469601e53",
  "artifacts": [
    {
      "path": "spaceclaim-vision-modeling/references/atomic-guidance/er-07.json",
      "sha256": "0031dfb7e87cf02b76c83d3dc9ca84e92c10c43fd1f56b560ce2d1146861568f",
      "role": "tool"
    },
    {
      "path": "tests/test_execution_guidance.py",
      "sha256": "f3918ac4379f5488144fab920f60d121aa4e5863ef91808bb4ae04b469601e53",
      "role": "test"
    },
    {
      "path": "spaceclaim-vision-modeling/assets/evaluations/p4-actions/raw-inputs.json",
      "sha256": "aabef50fb9f00315ad2bf3eee4bbb482f9be24552e26b944db850b135fa6ce9d",
      "role": "fixture"
    },
    {
      "path": "spaceclaim-vision-modeling/assets/evaluations/p4-actions/results.json",
      "sha256": "2bbacd139150806264d43f6bdf509562694c5c234bb5c1acb6861cbe4e706cc4",
      "role": "fixture"
    },
    {
      "path": "spaceclaim-vision-modeling/assets/evaluations/p4-actions/evaluation.md",
      "sha256": "e6db426ca8e019a47c4bec7d7e0f9394db4ddbcd130e9c9119de8cc9061930a0",
      "role": "fixture"
    },
    {
      "path": "spaceclaim-vision-modeling/assets/evaluations/p4-actions/delta-results.json",
      "sha256": "c62b76c542c9e655f7c02cd28fbaa875d652b1db1e8ed4738cfaa7a434122fb4",
      "role": "fixture"
    },
    {
      "path": "spaceclaim-vision-modeling/assets/evaluations/p4-actions/delta-evaluation.md",
      "sha256": "717cec638cce5f62e80a697721b1e364a912dda9f5bc42eafc76e8e71ee52ee8",
      "role": "fixture"
    }
  ],
  "evidence_boundary": {
    "design_only": {
      "status": "passed",
      "scope": "Guidance interface checked on host; synthetic independent application reviewed. No controller event or repaired geometry was observed for this guide."
    },
    "host_checked": {
      "status": "passed",
      "scope": "Interface structure checks only, not correctness of source interpretation or desktop execution."
    },
    "spaceclaim_execution": {
      "status": "not_tested",
      "scope": "This layer was not performed for this exact template."
    },
    "geometry_measurements": {
      "status": "not_tested",
      "scope": "This layer was not performed for this exact template."
    },
    "native_save": {
      "status": "not_tested",
      "scope": "This layer was not performed for this exact template."
    },
    "native_reopen": {
      "status": "not_tested",
      "scope": "This layer was not performed for this exact template."
    },
    "visual_review": {
      "status": "not_tested",
      "scope": "This layer was not performed for this exact template."
    },
    "requested_export": {
      "status": "not_tested",
      "scope": "This layer was not performed for this exact template."
    }
  },
  "notes": "Guidance interface checked on host; synthetic independent application reviewed. No controller event or repaired geometry was observed for this guide."
}
