{
  "evidence_record_version": 1,
  "operation_id": "modeling_strategy_scripting.extrude-profile-to-face",
  "template_version": "0.1.0",
  "recorded_on": "2026-09-08",
  "command": "SpaceClaim V21 P3 suite-advanced-08/report.json; selected MA-07 event; passed groups: until-planar-face",
  "result": "passed",
  "exit_code": 0,
  "tests_run": 1,
  "tool": "spaceclaim-vision-modeling/assets/operation-templates/modeling-strategy-scripting/actions/ma-07.scscript",
  "test": "spaceclaim-vision-modeling/assets/evaluations/p3-actions/snapshots/suite-advanced-08/harness.py",
  "tool_sha256": "f8a0b341acec55cf9826d26adb910db460cc9b56400044bb47f5452906f77cb6",
  "test_sha256": "cc9e159049c56f33bd4cb7f59ed74860af3d9965dd55e5e61d4d1b11f1cc10a0",
  "artifacts": [
    {
      "path": "spaceclaim-vision-modeling/assets/operation-templates/modeling-strategy-scripting/actions/ma-07.scscript",
      "sha256": "f8a0b341acec55cf9826d26adb910db460cc9b56400044bb47f5452906f77cb6",
      "role": "tool"
    },
    {
      "path": "spaceclaim-vision-modeling/assets/evaluations/p3-actions/snapshots/suite-advanced-08/harness.py",
      "sha256": "cc9e159049c56f33bd4cb7f59ed74860af3d9965dd55e5e61d4d1b11f1cc10a0",
      "role": "test"
    },
    {
      "path": "spaceclaim-vision-modeling/assets/evaluations/p3-actions/snapshots/suite-advanced-08/report.json",
      "sha256": "ec4f105cfe9b7f114fd83f94b92cf4d239a238d2598eb36c9a08729c72479638",
      "role": "fixture"
    },
    {
      "path": "spaceclaim-vision-modeling/assets/evaluations/p3-actions/snapshot-map.json",
      "sha256": "fa2e21847abe0a45234ad37d1c696fa02a0fe93a105cbc9d61bab51f4571adb5",
      "role": "fixture"
    }
  ],
  "evidence_boundary": {
    "design_only": {
      "status": "passed",
      "scope": "The candidate contract and catalog slug were schema-validated before runtime calibration."
    },
    "host_checked": {
      "status": "passed",
      "scope": "Exact action/report/test bindings were checked on the host; passed groups: until-planar-face."
    },
    "spaceclaim_execution": {
      "status": "passed",
      "scope": "One executed event in spaceclaim-vision-modeling/assets/evaluations/p3-actions/snapshots/suite-advanced-08/report.json matched spaceclaim-vision-modeling/assets/operation-templates/modeling-strategy-scripting/actions/ma-07.scscript and its extracted source bytes."
    },
    "geometry_measurements": {
      "status": "passed",
      "scope": "The independent group(s) until-planar-face passed in the recorded SpaceClaim suite runs/p3-live/suite-advanced-08/forward.py."
    },
    "native_save": {
      "status": "not_applicable",
      "scope": "The P3 action group does not save a native document."
    },
    "native_reopen": {
      "status": "not_applicable",
      "scope": "The P3 action group does not reopen a native document."
    },
    "visual_review": {
      "status": "not_tested",
      "scope": "No viewport or screenshot review was part of this action group."
    },
    "requested_export": {
      "status": "not_applicable",
      "scope": "No requested model export was part of this action group."
    }
  },
  "notes": "Exact action source/archive hashes match the historical run event and selected passing groups. The portable harness body is byte-identical after removing machine-specific configuration; it is not the full executed source. snapshot-map.json records the original configured source/archive hashes. No persistence, export or full visual claim."
}
