{
  "evidence_record_version": 1,
  "operation_id": "validation_visual_review.compare-runtime-reports",
  "template_version": "0.1.1",
  "recorded_on": "2026-09-03",
  "command": "python -m unittest discover -s tests -p test_compare_runtime_reports.py -q",
  "result": "passed",
  "exit_code": 0,
  "tests_run": 9,
  "tool": "spaceclaim-vision-modeling/scripts/compare_runtime_reports.py",
  "test": "tests/test_compare_runtime_reports.py",
  "tool_sha256": "859f646eba8a320f48930851152cc815a96792dd879339b0dfd5bcddf091832c",
  "test_sha256": "1895c48480a79e12450430116c85cd4ef971870ed6e108cb92eb040eb60a782b",
  "artifacts": [
    {
      "path": "spaceclaim-vision-modeling/scripts/compare_runtime_reports.py",
      "role": "tool",
      "sha256": "859f646eba8a320f48930851152cc815a96792dd879339b0dfd5bcddf091832c"
    },
    {
      "path": "tests/test_compare_runtime_reports.py",
      "role": "test",
      "sha256": "1895c48480a79e12450430116c85cd4ef971870ed6e108cb92eb040eb60a782b"
    }
  ],
  "evidence_boundary": {
    "design_only": {
      "status": "passed",
      "scope": "The host-only forward versus native-reopen comparison contract and tolerances were reviewed."
    },
    "host_checked": {
      "status": "passed",
      "scope": "Nine repository unit tests passed for persistence comparisons, distinct-input and status gates, tolerances, and feature checks."
    },
    "spaceclaim_execution": {
      "status": "not_applicable",
      "scope": "No SpaceClaim process was launched."
    },
    "geometry_measurements": {
      "status": "not_applicable",
      "scope": "The comparator compares declared measurements but does not independently measure geometry."
    },
    "native_save": {
      "status": "not_applicable",
      "scope": "No native SpaceClaim document was saved by this operation."
    },
    "native_reopen": {
      "status": "not_applicable",
      "scope": "No native SpaceClaim document was reopened by this operation."
    },
    "visual_review": {
      "status": "not_applicable",
      "scope": "No application viewport or image was reviewed."
    },
    "requested_export": {
      "status": "not_applicable",
      "scope": "No model export was requested or produced by this host operation."
    }
  },
  "notes": "The comparison is limited to report-to-report persistence fields and does not prove that either report came from a SpaceClaim run."
}
